{
  "schema_version": 1,
  "task_id": "01a0ec82-72d7-7f23-8be6-203712701f21",
  "changed_fields": ["due_on", "title"],
  "doc": {
    "title": "Collect logo references for Acme",
    "body": "Open the moodboard",
    "deleted": false,
    "project_id": "01a0ec82-72d7-7f23-8be6-203712701f10",
    "updated_at": "2026-03-09T12:05:00Z"
  }
}
